{
  "$schema": "http://json-schema.org/draft-07/schema#",
  "$id": "https://ruankaodaren.example/schemas/ruankaodaren-ai-learning-generation-execution-authorization-gate.schema.json",
  "title": "Phase 7.3 AI Learning Generation Execution Authorization Gate",
  "description": "Schema for the Phase 7.3 AI learning generation execution authorization gate manifest.",
  "type": "object",
  "required": [
    "manifest_version",
    "manifest_type",
    "phase",
    "artifact_type",
    "status",
    "created_for_phase",
    "created_at",
    "authorization_status",
    "authorization_result",
    "authorization_mode",
    "upstream_phase",
    "upstream_manifest",
    "upstream_artifact_type",
    "upstream_commit",
    "upstream_execution_plan_status",
    "upstream_execution_status",
    "upstream_execution_mode",
    "upstream_ai_learning_content_generation_allowed",
    "authorized_execution_phase",
    "authorized_execution_mode",
    "batch_id",
    "crawler_allowed",
    "renderer_allowed",
    "recovery_allowed",
    "web_requests_allowed",
    "source_layer_modification_allowed",
    "ai_learning_content_generation_allowed",
    "ai_learning_execution_authorization_allowed",
    "ai_learning_request_creation_allowed",
    "phase7_3_entry_allowed",
    "phase7_4_entry_allowed",
    "authorized_future_outputs",
    "actual_generated_outputs",
    "scope",
    "risk",
    "closure",
    "next_phase_recommendation",
    "rollback_condition",
    "audit_condition",
    "phase_progression_history",
    "validation_expectations"
  ],
  "properties": {
    "manifest_version": { "const": "phase7.3" },
    "manifest_type": { "const": "ai_learning_generation_execution_authorization_gate" },
    "phase": { "const": "7.3" },
    "artifact_type": { "const": "ai_learning_generation_execution_authorization_gate" },
    "status": { "const": "ai_learning_generation_execution_authorization_gate_created" },
    "created_for_phase": { "const": "7.3" },
    "created_at": { "type": "string", "format": "date-time" },
    "authorization_status": { "const": "authorized" },
    "authorization_result": { "const": "pass" },
    "authorization_mode": { "const": "authorization_only" },
    "upstream_phase": { "const": "7.2" },
    "upstream_manifest": { "const": "phase7_2_ai_learning_generation_execution_plan.json" },
    "upstream_artifact_type": { "const": "ai_learning_generation_execution_plan" },
    "upstream_commit": { "const": "6f0ac44" },
    "upstream_execution_plan_status": { "const": "planned" },
    "upstream_execution_status": { "const": "not_started" },
    "upstream_execution_mode": { "const": "offline_existing_source_packet_only" },
    "upstream_ai_learning_content_generation_allowed": { "const": true },
    "authorized_execution_phase": { "const": "7.4" },
    "authorized_execution_mode": { "const": "offline_existing_source_packet_only" },
    "batch_id": { "const": "phase6_1_batch_001" },
    "crawler_allowed": { "const": false },
    "renderer_allowed": { "const": false },
    "recovery_allowed": { "const": false },
    "web_requests_allowed": { "const": false },
    "source_layer_modification_allowed": { "const": false },
    "ai_learning_content_generation_allowed": { "const": false },
    "ai_learning_execution_authorization_allowed": { "const": true },
    "ai_learning_request_creation_allowed": { "const": true },
    "phase7_3_entry_allowed": { "const": true },
    "phase7_4_entry_allowed": { "const": true },
    "authorized_future_outputs": {
      "type": "array",
      "items": {
        "type": "string",
        "enum": [
          "learning_objectives",
          "knowledge_units",
          "exam_oriented_explanations",
          "practice_questions",
          "answer_rationales",
          "misconception_warnings",
          "review_checklist",
          "source_traceability_map"
        ]
      },
      "minItems": 8,
      "maxItems": 8
    },
    "actual_generated_outputs": {
      "type": "array",
      "maxItems": 0
    },
    "scope": {
      "type": "object",
      "required": [
        "allowed",
        "forbidden",
        "allowed_source_basis",
        "unapproved_sources_allowed",
        "external_sources_allowed",
        "source_expansion_allowed",
        "offline_only"
      ],
      "properties": {
        "allowed": { "type": "array", "items": { "type": "string" }, "minItems": 1 },
        "forbidden": { "type": "array", "items": { "type": "string" }, "minItems": 1 },
        "allowed_source_basis": { "const": "closed_pass_phase6_1_batch_001_only" },
        "unapproved_sources_allowed": { "const": false },
        "external_sources_allowed": { "const": false },
        "source_expansion_allowed": { "const": false },
        "offline_only": { "const": true }
      },
      "additionalProperties": false
    },
    "risk": {
      "type": "object",
      "required": ["risk_level", "risk_reason"],
      "properties": {
        "risk_level": { "const": "low" },
        "risk_reason": { "type": "string" }
      },
      "additionalProperties": false
    },
    "closure": {
      "type": "object",
      "required": ["phase7_3_status", "phase7_3_result"],
      "properties": {
        "phase7_3_status": { "const": "complete" },
        "phase7_3_result": { "const": "pass" }
      },
      "additionalProperties": false
    },
    "next_phase_recommendation": {
      "type": "object",
      "required": [
        "next_recommended_phase",
        "phase7_4_entry_allowed",
        "phase7_4_entry_requires_authorization_gate",
        "notes"
      ],
      "properties": {
        "next_recommended_phase": { "const": "phase7.4_ai_learning_generation_execution" },
        "phase7_4_entry_allowed": { "const": true },
        "phase7_4_entry_requires_authorization_gate": { "const": true },
        "notes": { "type": "string" }
      },
      "additionalProperties": false
    },
    "rollback_condition": {
      "type": "object",
      "required": ["phase7_3_rollback_needed", "reason", "future_rollback_requirements"],
      "properties": {
        "phase7_3_rollback_needed": { "const": false },
        "reason": { "type": "string" },
        "future_rollback_requirements": { "type": "array", "items": { "type": "string" }, "minItems": 1 }
      },
      "additionalProperties": false
    },
    "audit_condition": {
      "type": "object",
      "required": [
        "upstream_phase",
        "upstream_artifact_type",
        "upstream_commit",
        "upstream_execution_plan_status",
        "upstream_execution_status",
        "upstream_execution_mode",
        "upstream_ai_learning_content_generation_allowed",
        "current_authorization_status",
        "current_authorization_result",
        "current_ai_learning_content_generation_allowed",
        "current_phase7_4_entry_allowed",
        "authorized_future_output_count",
        "actual_generated_outputs_empty",
        "validation_commands",
        "commit_scope"
      ],
      "properties": {
        "upstream_phase": { "const": "7.2" },
        "upstream_artifact_type": { "const": "ai_learning_generation_execution_plan" },
        "upstream_commit": { "const": "6f0ac44" },
        "upstream_execution_plan_status": { "const": "planned" },
        "upstream_execution_status": { "const": "not_started" },
        "upstream_execution_mode": { "const": "offline_existing_source_packet_only" },
        "upstream_ai_learning_content_generation_allowed": { "const": true },
        "current_authorization_status": { "const": "authorized" },
        "current_authorization_result": { "const": "pass" },
        "current_ai_learning_content_generation_allowed": { "const": false },
        "current_phase7_4_entry_allowed": { "const": true },
        "authorized_future_output_count": { "const": 8 },
        "actual_generated_outputs_empty": { "const": true },
        "validation_commands": { "type": "array", "items": { "type": "string" }, "minItems": 1 },
        "commit_scope": { "type": "string" }
      },
      "additionalProperties": false
    },
    "phase_progression_history": {
      "type": "array",
      "items": {
        "type": "object",
        "required": ["phase", "outcome"],
        "properties": {
          "phase": { "type": "string" },
          "outcome": { "type": "string" }
        },
        "additionalProperties": false
      },
      "minItems": 4,
      "maxItems": 4
    },
    "validation_expectations": {
      "type": "object",
      "required": [
        "schema_validation",
        "invariant_checks",
        "phase_must_be",
        "artifact_type_must_be",
        "authorization_status_must_be",
        "authorization_result_must_be",
        "authorization_mode_must_be",
        "upstream_phase_must_be",
        "upstream_artifact_type_must_be",
        "upstream_commit_must_be",
        "upstream_execution_plan_status_must_be",
        "upstream_execution_status_must_be",
        "upstream_execution_mode_must_be",
        "upstream_ai_learning_content_generation_allowed_must_be",
        "batch_id_must_be",
        "authorized_execution_phase_must_be",
        "authorized_execution_mode_must_be",
        "ai_learning_content_generation_allowed_must_be",
        "ai_learning_execution_authorization_allowed_must_be",
        "phase7_4_entry_allowed_must_be",
        "crawler_allowed_must_be",
        "renderer_allowed_must_be",
        "recovery_allowed_must_be",
        "web_requests_allowed_must_be",
        "source_layer_modification_allowed_must_be",
        "actual_generated_outputs_must_be_empty",
        "authorized_future_output_count_must_be",
        "risk_level_must_be",
        "closure_status_must_be",
        "closure_result_must_be"
      ],
      "properties": {
        "schema_validation": { "const": "must_pass" },
        "invariant_checks": { "const": "must_pass" },
        "phase_must_be": { "const": "7.3" },
        "artifact_type_must_be": { "const": "ai_learning_generation_execution_authorization_gate" },
        "authorization_status_must_be": { "const": "authorized" },
        "authorization_result_must_be": { "const": "pass" },
        "authorization_mode_must_be": { "const": "authorization_only" },
        "upstream_phase_must_be": { "const": "7.2" },
        "upstream_artifact_type_must_be": { "const": "ai_learning_generation_execution_plan" },
        "upstream_commit_must_be": { "const": "6f0ac44" },
        "upstream_execution_plan_status_must_be": { "const": "planned" },
        "upstream_execution_status_must_be": { "const": "not_started" },
        "upstream_execution_mode_must_be": { "const": "offline_existing_source_packet_only" },
        "upstream_ai_learning_content_generation_allowed_must_be": { "const": true },
        "batch_id_must_be": { "const": "phase6_1_batch_001" },
        "authorized_execution_phase_must_be": { "const": "7.4" },
        "authorized_execution_mode_must_be": { "const": "offline_existing_source_packet_only" },
        "ai_learning_content_generation_allowed_must_be": { "const": false },
        "ai_learning_execution_authorization_allowed_must_be": { "const": true },
        "phase7_4_entry_allowed_must_be": { "const": true },
        "crawler_allowed_must_be": { "const": false },
        "renderer_allowed_must_be": { "const": false },
        "recovery_allowed_must_be": { "const": false },
        "web_requests_allowed_must_be": { "const": false },
        "source_layer_modification_allowed_must_be": { "const": false },
        "actual_generated_outputs_must_be_empty": { "const": true },
        "authorized_future_output_count_must_be": { "const": 8 },
        "risk_level_must_be": { "const": "low" },
        "closure_status_must_be": { "const": "complete" },
        "closure_result_must_be": { "const": "pass" }
      },
      "additionalProperties": false
    }
  },
  "additionalProperties": false
}
