{
  "manifest_version": "phase7.3",
  "manifest_type": "ai_learning_generation_execution_authorization_gate",
  "phase": "7.3",
  "artifact_type": "ai_learning_generation_execution_authorization_gate",
  "status": "ai_learning_generation_execution_authorization_gate_created",
  "created_for_phase": "7.3",
  "created_at": "2026-06-04T00:00:00Z",

  "authorization_status": "authorized",
  "authorization_result": "pass",
  "authorization_mode": "authorization_only",

  "upstream_phase": "7.2",
  "upstream_manifest": "phase7_2_ai_learning_generation_execution_plan.json",
  "upstream_artifact_type": "ai_learning_generation_execution_plan",
  "upstream_commit": "6f0ac44",
  "upstream_execution_plan_status": "planned",
  "upstream_execution_status": "not_started",
  "upstream_execution_mode": "offline_existing_source_packet_only",
  "upstream_ai_learning_content_generation_allowed": true,

  "authorized_execution_phase": "7.4",
  "authorized_execution_mode": "offline_existing_source_packet_only",

  "batch_id": "phase6_1_batch_001",

  "crawler_allowed": false,
  "renderer_allowed": false,
  "recovery_allowed": false,
  "web_requests_allowed": false,
  "source_layer_modification_allowed": false,
  "ai_learning_content_generation_allowed": false,
  "ai_learning_execution_authorization_allowed": true,
  "ai_learning_request_creation_allowed": true,
  "phase7_3_entry_allowed": true,
  "phase7_4_entry_allowed": true,

  "authorized_future_outputs": [
    "learning_objectives",
    "knowledge_units",
    "exam_oriented_explanations",
    "practice_questions",
    "answer_rationales",
    "misconception_warnings",
    "review_checklist",
    "source_traceability_map"
  ],
  "actual_generated_outputs": [],

  "scope": {
    "allowed": [
      "AI learning generation execution authorization",
      "Phase 7.4 execution authorization",
      "authorization gate documentation",
      "authorized output documentation",
      "authorization decision documentation",
      "upstream plan reference",
      "upstream commit reference"
    ],
    "forbidden": [
      "AI learning content generation",
      "study notes creation",
      "question bank creation",
      "explanations creation",
      "flashcard creation",
      "diagram creation",
      "summary creation",
      "rendered learning content creation",
      "crawler execution",
      "renderer execution",
      "recovery execution",
      "web requests",
      "source layer mutation",
      "raw snapshot creation",
      "intermediate JSON creation",
      "asset capture"
    ],
    "allowed_source_basis": "closed_pass_phase6_1_batch_001_only",
    "unapproved_sources_allowed": false,
    "external_sources_allowed": false,
    "source_expansion_allowed": false,
    "offline_only": true
  },

  "risk": {
    "risk_level": "low",
    "risk_reason": "Phase 7.3 authorizes a later offline generation execution but does not itself generate learning content or mutate source-layer artifacts."
  },

  "closure": {
    "phase7_3_status": "complete",
    "phase7_3_result": "pass"
  },

  "next_phase_recommendation": {
    "next_recommended_phase": "phase7.4_ai_learning_generation_execution",
    "phase7_4_entry_allowed": true,
    "phase7_4_entry_requires_authorization_gate": true,
    "notes": "Phase 7.4 is authorized by this artifact. Phase 7.4 must generate actual AI learning content within the boundaries defined by the Phase 7.2 execution plan and authorized by this Phase 7.3 authorization gate."
  },

  "rollback_condition": {
    "phase7_3_rollback_needed": false,
    "reason": "Authorization gate recorded as metadata only; no content generation occurred.",
    "future_rollback_requirements": [
      "If the authorization decision is found to be incorrect, it must be revoked",
      "If the approved execution plan changes, the authorization must be re-evaluated",
      "If the Phase 7.1 approval is revoked, the authorization must be invalidated"
    ]
  },

  "audit_condition": {
    "upstream_phase": "7.2",
    "upstream_artifact_type": "ai_learning_generation_execution_plan",
    "upstream_commit": "6f0ac44",
    "upstream_execution_plan_status": "planned",
    "upstream_execution_status": "not_started",
    "upstream_execution_mode": "offline_existing_source_packet_only",
    "upstream_ai_learning_content_generation_allowed": true,
    "current_authorization_status": "authorized",
    "current_authorization_result": "pass",
    "current_ai_learning_content_generation_allowed": false,
    "current_phase7_4_entry_allowed": true,
    "authorized_future_output_count": 8,
    "actual_generated_outputs_empty": true,
    "validation_commands": [
      "pnpm typecheck",
      "pnpm verify",
      "pnpm validate:ai-learning-generation-execution-plan",
      "pnpm validate:ai-learning-generation-execution-authorization-gate"
    ],
    "commit_scope": "Phase 7.3 AI learning generation execution authorization gate files and related schema/type/validator/package verification changes only"
  },

  "phase_progression_history": [
    { "phase": "7.0", "outcome": "ai_learning_generation_request_created" },
    { "phase": "7.1", "outcome": "ai_learning_generation_approval_gate_recorded" },
    { "phase": "7.2", "outcome": "ai_learning_generation_execution_plan_created" },
    { "phase": "7.3", "outcome": "ai_learning_generation_execution_authorization_gate_created" }
  ],

  "validation_expectations": {
    "schema_validation": "must_pass",
    "invariant_checks": "must_pass",
    "phase_must_be": "7.3",
    "artifact_type_must_be": "ai_learning_generation_execution_authorization_gate",
    "authorization_status_must_be": "authorized",
    "authorization_result_must_be": "pass",
    "authorization_mode_must_be": "authorization_only",
    "upstream_phase_must_be": "7.2",
    "upstream_artifact_type_must_be": "ai_learning_generation_execution_plan",
    "upstream_commit_must_be": "6f0ac44",
    "upstream_execution_plan_status_must_be": "planned",
    "upstream_execution_status_must_be": "not_started",
    "upstream_execution_mode_must_be": "offline_existing_source_packet_only",
    "upstream_ai_learning_content_generation_allowed_must_be": true,
    "batch_id_must_be": "phase6_1_batch_001",
    "authorized_execution_phase_must_be": "7.4",
    "authorized_execution_mode_must_be": "offline_existing_source_packet_only",
    "ai_learning_content_generation_allowed_must_be": false,
    "ai_learning_execution_authorization_allowed_must_be": true,
    "phase7_4_entry_allowed_must_be": true,
    "crawler_allowed_must_be": false,
    "renderer_allowed_must_be": false,
    "recovery_allowed_must_be": false,
    "web_requests_allowed_must_be": false,
    "source_layer_modification_allowed_must_be": false,
    "actual_generated_outputs_must_be_empty": true,
    "authorized_future_output_count_must_be": 8,
    "risk_level_must_be": "low",
    "closure_status_must_be": "complete",
    "closure_result_must_be": "pass"
  }
}
